title,category,content
"Breakthrough in Quantum Computing","Technology","Researchers at leading technology companies and academic institutions have achieved a major breakthrough in quantum computing that could revolutionize the field. The innovative approach significantly reduces computational requirements by 40% while maintaining or even improving performance levels. This technique, termed efficient attention mechanisms, represents a paradigm shift in how quantum algorithms process information. The development promises to democratize access to advanced quantum computing capabilities, making them available to smaller organizations, startups, and individual researchers who previously lacked the necessary computational resources. The implications extend across numerous industries, from pharmaceutical drug discovery and financial modeling to climate science and artificial intelligence development. Scientists involved in the project believe this marks a crucial inflection point in the journey toward practical, commercially viable quantum computers. The innovation directly addresses one of the field's most persistent challenges: the massive computational overhead traditionally required to run meaningful quantum algorithms. Early adopters in the healthcare sector are already exploring applications for protein folding simulations and personalized medicine. Financial institutions are investigating potential uses in risk assessment and portfolio optimization. The breakthrough was achieved through a combination of novel algorithmic approaches and hardware optimizations that work in concert to maximize efficiency. Industry experts and venture capitalists predict widespread implementation and commercialization within the next five years. Several Fortune 500 companies have already expressed interest in pilot programs. Academic institutions are incorporating these findings into their quantum computing curricula. The research team, which includes Nobel laureates and leading computer scientists, published their results in a peer-reviewed journal last month. Government agencies responsible for technology policy are assessing the implications for national competitiveness and security. International collaborations are forming to further develop and refine the technology. The stock prices of quantum computing companies surged following the announcement, with some seeing gains of over 30% in a single trading session."
"Climate Change Impact on Ocean Currents","Science","A groundbreaking comprehensive study spanning three full decades has revealed alarming and significant changes in global ocean current patterns, directly attributable to rising planetary temperatures. The research, conducted by an international consortium of marine scientists and oceanographers, focuses particularly on the Atlantic Meridional Overturning Circulation, often called AMOC, which has weakened by approximately 15% since systematic measurements began in the early 1990s. This weakening trend shows no signs of slowing and may be accelerating according to the latest data analysis. Scientists warn with increasing urgency that continued weakening could trigger dramatic and potentially irreversible effects on weather patterns across Europe and North America, affecting billions of people. Marine ecosystems from the Arctic to the Antarctic are already exhibiting clear signs of stress and disruption from these fundamental changes in ocean dynamics. The research utilized an unprecedented dataset from hundreds of sophisticated ocean monitoring stations strategically positioned worldwide, including deep-sea sensors, satellite measurements, and advanced computational modeling. The implications for global climate models are substantial and far-reaching, potentially requiring significant revisions to current predictions about future climate scenarios. Researchers emphasize with stark clarity the absolute urgency of implementing aggressive measures to address carbon emissions and prevent further catastrophic disruption to ocean systems that regulate Earth's climate. The study documents changes in water temperature, salinity levels, and current velocities at various depths. Particular concern centers on the potential for abrupt tipping points where gradual changes suddenly accelerate into rapid, non-linear shifts. Historical climate data suggests such events have occurred in Earth's past with devastating consequences for regional climates. The research team employed sophisticated computer simulations running on supercomputers to model potential future scenarios under different emissions pathways. Their findings indicate that without immediate and sustained reductions in greenhouse gas emissions, the AMOC could weaken by an additional 30-40% by 2100. This would likely result in cooler temperatures across Northwestern Europe, altered precipitation patterns, more intense storms, and significant disruptions to marine fisheries that millions depend upon for food and livelihoods. The study has prompted urgent calls for international cooperation and policy action from environmental organizations, scientific bodies, and progressive political leaders worldwide."
"Global Stock Markets Reach Record Highs","Business","Major stock market indices across Asia, Europe, and the Americas simultaneously reached unprecedented record levels this week, marking a historic moment in global financial markets. The remarkable rally was driven by a confluence of factors including exceptionally strong corporate earnings reports, optimistic economic forecasts from leading financial institutions, and growing investor confidence in sustained economic growth. The benchmark S&P 500 index closed decisively above the psychologically significant 5,000-point threshold for the first time in its illustrious history, while the Dow Jones Industrial Average and NASDAQ Composite also set new all-time highs. Technology giants and healthcare companies led the impressive rally with robust double-digit percentage gains, reflecting strong consumer demand and innovation in these sectors. Investors are demonstrating renewed confidence and risk appetite despite ongoing geopolitical tensions, trade disputes, and concerns about inflation in various regions. Central banks' accommodative monetary policies, including historically low interest rates and quantitative easing programs, continue to provide substantial support for market growth and liquidity. However, seasoned analysts and economists are increasingly cautioning that valuations in certain sectors, particularly technology and growth stocks, may be significantly stretched relative to historical norms and fundamental metrics. Financial advisors across the industry are strongly recommending that individual investors maintain well-diversified portfolios spanning multiple asset classes, sectors, and geographic regions in the current environment of elevated valuations and potential market volatility. Trading volumes have been extraordinarily high, indicating broad participation across institutional investors, retail traders, and algorithmic trading systems. Options markets show elevated activity with bullish sentiment prevailing. Earnings reports from major corporations exceeded expectations by an average of 12%, well above historical trends. Revenue growth has been particularly strong in cloud computing, biotechnology, renewable energy, and consumer discretionary sectors. Market breadth indicators suggest the rally is broad-based rather than concentrated in a handful of stocks. However, some contrarian investors and hedge fund managers are expressing concern about potential market corrections. Bond yields remain relatively low despite stock market gains, presenting a puzzle for traditional portfolio theory. International investors are increasing their exposure to U.S. markets, attracted by strong economic growth and corporate profitability. Emerging markets are also participating in the rally, though with more volatility."
"Revolutionary AI Model for Medical Diagnosis","Technology","A groundbreaking new artificial intelligence system has demonstrated truly remarkable accuracy in detecting early-stage diseases from complex medical imaging data, potentially revolutionizing diagnostic medicine. The sophisticated deep learning model consistently outperforms even the most experienced human radiologists in identifying certain types of cancers and other serious conditions by meticulously analyzing incredibly subtle patterns and anomalies that remain completely invisible to the human eye, even with years of specialized training. Comprehensive clinical trials conducted across ten major teaching hospitals and medical centers spanning three continents show an impressive 95% accuracy rate for early detection of various malignancies, significantly higher than traditional diagnostic methods. The advanced system leverages cutting-edge deep learning techniques and neural network architectures, having been meticulously trained on a massive dataset of millions of carefully annotated medical images including X-rays, CT scans, MRIs, and ultrasounds from diverse patient populations. Healthcare providers and hospital systems worldwide are actively preparing detailed implementation roadmaps for gradual integration of this technology over the next two years, working closely with regulatory bodies to ensure proper validation and certification. Patient privacy protection and robust data security measures remain absolutely paramount priorities in all deployment plans, with end-to-end encryption and strict access controls built into the system architecture from the ground up. Leading medical professionals and physician groups universally view this revolutionary technology as a powerful complementary tool that enhances rather than replaces irreplaceable human medical expertise, clinical judgment, and the crucial doctor-patient relationship. The system has been designed with an intuitive interface that allows radiologists to review AI-generated findings alongside their own analysis, with clear explanations for each diagnostic suggestion. Early adopters report that the technology has helped identify cases that might have been missed or delayed in traditional workflows. Insurance companies are beginning to cover AI-assisted diagnostics, recognizing the potential for earlier intervention and better patient outcomes. Medical schools are incorporating AI literacy into their curricula to prepare the next generation of physicians. The technology is particularly promising for underserved rural areas where specialist radiologists may not be readily available. Telemedicine platforms are integrating the AI system to provide expert-level diagnostic capabilities remotely. Research continues into expanding the system's capabilities to additional disease types and imaging modalities. The development team includes leading computer scientists, radiologists, oncologists, and bioethicists working collaboratively. Peer-reviewed publications in top medical journals have validated the system's performance across diverse patient demographics. Regulatory approval processes are underway in major markets including the US, EU, and Asia. The technology represents a significant step forward in the ongoing digital transformation of healthcare delivery."
"Discovery of Ancient Underground City","Science","In an extraordinary archaeological breakthrough that has captured worldwide attention, researchers have uncovered a remarkably vast and sophisticated underground city in central Turkey that dates back approximately 2,500 years, offering unprecedented insights into ancient civilizations. The sprawling subterranean complex extends across an astonishing eight distinct levels reaching depths of over 100 meters, with interconnected chambers and passages that could comfortably have housed and sustained up to 20,000 people for extended periods during times of conflict or environmental hardship. The discovery features remarkably sophisticated ventilation systems with precisely engineered air shafts, extensive food storage facilities with temperature-controlled chambers, and even underground wells providing fresh water, all indicating surprisingly advanced engineering knowledge and urban planning capabilities that challenge our previous understanding of ancient technology. This monumental discovery provides fascinating new insights into ancient civilization's ingenious survival strategies during periods of invasion, warfare, and other existential threats, revealing how entire communities could essentially disappear underground while maintaining relatively normal daily life. Meticulous preservation efforts coordinated by UNESCO and Turkish authorities are currently underway to protect the extremely fragile ancient structures from deterioration, tourism impact, and environmental damage while making select areas accessible for research and eventual public viewing. The extensive site features an intricate network of narrow tunnels and wider passages connecting various functional areas including residential living quarters, communal religious or ceremonial spaces, food preparation areas, livestock stables, and sophisticated storage facilities for grain, wine, and other provisions. International teams of archaeologists, engineers, and historians believe many more chambers, artifacts, and secrets remain unexplored in the deeper, more dangerous levels that are currently inaccessible due to stability concerns and require advanced excavation techniques. This remarkable find has been unanimously ranked among the most significant and enlightening archaeological discoveries of the entire decade by leading experts and professional archaeological societies worldwide. The city shows evidence of multiple periods of occupation and expansion over centuries. Advanced ground-penetrating radar suggests the complex may extend even further than currently mapped. Artifacts recovered include pottery, tools, jewelry, and remarkably preserved organic materials. Epigraphic evidence provides clues about the inhabitants' language and culture. The site is being studied using the latest archaeological technologies including 3D laser scanning, photogrammetry, and environmental DNA analysis. International collaborative research projects are planned involving institutions from over a dozen countries. The discovery has implications for our understanding of urban planning, social organization, and technological capabilities in the ancient world."
"Electric Vehicle Sales Surge Globally","Business","Electric vehicle sales have dramatically exceeded 10 million units globally last year alone, representing an extraordinary 65% increase from the previous year and marking a historic turning point in the automotive industry's transition toward sustainable transportation. The People's Republic of China continues to dominate and lead the global market with nearly half of all electric vehicle sales worldwide, followed by the European Union with aggressive emissions regulations and North America where consumer attitudes are rapidly shifting toward environmental consciousness and fuel cost savings. Major traditional automakers including industry giants are aggressively expanding their production capacity and retooling existing factories to meet the seemingly insatiable and rapidly growing consumer demand for electric vehicles across all market segments from affordable compact cars to luxury SUVs. Revolutionary battery technology improvements and breakthroughs in energy density have successfully extended practical driving ranges well beyond the psychologically important 300-mile threshold for most mainstream models, effectively eliminating range anxiety that previously deterred many potential buyers. Charging infrastructure development and investment is accelerating dramatically in urban and suburban areas worldwide, with governments and private companies installing hundreds of thousands of new fast-charging stations annually along highways, in parking facilities, and at retail locations. Generous government incentives including tax credits, rebates, HOV lane access, and reduced registration fees continue to be major drivers of adoption in many countries, making electric vehicles price-competitive with comparable gasoline-powered alternatives. Leading industry analysts and market researchers project that electric vehicles will comprise approximately 30% of all new car sales globally by 2030, with some regions potentially reaching even higher penetration rates depending on policy support and infrastructure readiness. Traditional established automakers with over a century of internal combustion engine expertise are investing tens of billions of dollars collectively in electric vehicle technology, battery production, and charging networks to remain competitive in this rapidly transforming market or risk becoming obsolete. Several legacy manufacturers have announced plans to phase out gasoline-powered vehicles entirely within the next 10-15 years. Start-up electric vehicle companies continue to attract massive venture capital funding and public market valuations. Battery manufacturing capacity is expanding globally with gigafactories being built on multiple continents. Concerns about mineral supply chains for lithium, cobalt, and other critical materials are driving investment in recycling technology and alternative battery chemistries. Vehicle-to-grid technologies that allow electric vehicles to help stabilize power grids are being tested in pilot programs. Consumer surveys show increasing interest driven by lower operating costs, environmental concerns, and technological appeal."
"Advances in Renewable Energy Storage","Technology","Leading scientists and engineers at premier research institutions have successfully developed a revolutionary new battery technology capable of storing renewable energy generated from solar panels and wind turbines for remarkably extended periods with absolutely minimal performance degradation, potentially solving one of the renewable energy sector's most persistent and vexing challenges. This game-changing innovation directly and effectively addresses one of the fundamental limitations that has long plagued solar and wind power generation: the inherently intermittent and unpredictable nature of these renewable energy sources that depend entirely on weather conditions and time of day, making grid integration and reliability difficult to guarantee. Extensive large-scale field testing conducted at multiple demonstration sites under diverse climate conditions consistently shows that these advanced batteries maintain an impressive 90% of their original storage capacity even after an unprecedented 10,000 complete charge and discharge cycles, far exceeding the performance of current lithium-ion technology which typically degrades much faster. Manufacturing costs for these innovative batteries are ambitiously projected to decrease by approximately 50% over the next three years as production scales up and supply chains mature, making them economically competitive with fossil fuel backup power and potentially transforming the economics of renewable energy deployment worldwide. Major energy companies and utilities in multiple countries are actively planning and funding ambitious pilot projects at existing renewable energy facilities to validate the technology at commercial scale and work out any remaining technical or operational challenges before widespread deployment. The breakthrough technology innovatively uses abundant, readily available, and environmentally friendly materials including sodium, iron, and organic compounds rather than scarce and problematic resources like cobalt or lithium, significantly improving sustainability and reducing geopolitical supply chain risks that have complicated previous battery technologies. Leading energy experts, analysts, and environmental advocates believe this could realistically be the critical technological breakthrough that enables truly widespread and economically viable renewable energy adoption at scale, finally allowing renewables to completely replace fossil fuels for baseload power generation. Grid operators and utility companies are particularly enthusiastic about the technology's tremendous potential for stabilizing power supplies, managing peak demand, and providing essential grid services like frequency regulation, all of which are crucial for maintaining reliable electricity delivery as renewable penetration increases. The batteries can be deployed at various scales from residential to utility-scale installations. Early economic analyses suggest payback periods of under five years for commercial applications. The technology has attracted significant venture capital investment and government research funding. Partnership agreements are being negotiated with major renewable energy developers. The development team has filed numerous patents covering key aspects of the chemistry and manufacturing processes. Field tests are expanding to include extreme climate conditions from arctic to tropical regions. Integration with smart grid technologies and AI-powered energy management systems is being actively developed."
"Mental Health Crisis Among Young Adults","Science","A comprehensive and methodologically rigorous global survey involving over 100,000 participants across 50 countries reveals deeply alarming and statistically significant increases in diagnosed anxiety disorders, clinical depression, and other serious mental health conditions among young adults specifically aged 18-25, representing a generational crisis that demands immediate attention and resources. Excessive social media usage creating unrealistic social comparisons and FOMO, combined with pandemic-related prolonged social isolation and economic uncertainty, have been conclusively identified as the primary contributing environmental factors driving this unprecedented mental health emergency according to the peer-reviewed research. Mental health professionals, counselors, and therapists in both private practice and institutional settings report completely unprecedented and overwhelming demand for their services, with many maintaining lengthy waiting lists and struggling to meet the acute need for immediate intervention and ongoing therapeutic support. Progressive universities, forward-thinking employers, and enlightened educational institutions are rapidly implementing comprehensive new support programs including counseling services, mental health days, stress management workshops, and peer support networks in response to the growing crisis and student/employee advocacy. Leading researchers and clinical psychologists strongly emphasize the critical importance of early intervention strategies and genuinely accessible, affordable treatment options before conditions become chronic and more difficult to treat successfully. The persistent stigma traditionally surrounding mental health issues continues to steadily decrease across demographics, particularly among younger generations, encouraging more people to proactively seek professional help without shame or fear of judgment. Innovative telehealth services and digital mental health platforms have dramatically expanded practical access to quality mental health care for people in rural areas, those with mobility limitations, and individuals who prefer the privacy and convenience of remote treatment. Progressive policymakers and legislators in numerous jurisdictions are actively considering and in some cases passing legislation for substantially increased government funding for mental health initiatives, recognizing mental health as equally important as physical health. The comprehensive study explicitly calls for holistic, evidence-based approaches addressing both individual psychological factors and broader societal conditions including economic inequality, social fragmentation, and cultural pressures. Workplace mental health programs are becoming standard benefits at leading companies. University counseling centers are expanding staffing and services. Insurance coverage for mental health treatment is improving. Mobile mental health apps are proliferating. Research into novel treatments including psychedelic-assisted therapy shows promise. School-based mental health screening programs are being implemented. Community mental health centers are receiving increased funding."
